synset_id	old_value	new_value	reason	source	date
wnja-80001383-n		東アジアの伝説上の鳥。鳥類の王とされ、吉祥の象徴とされる。	new JA definition from EN	audit/missing-defs	2026-05-30
wnja-80001425-n		親・目上の者・祖先に対して敬意と愛情を持ち、孝行を尽くす行為や心がけ。	new JA definition from EN	audit/missing-defs	2026-05-30
wnja-80001475-n		伸びたり縮んだりすること。伸縮性があること。	new JA definition from EN	audit/missing-defs	2026-05-30
wnja-80001489-n		ヤマノイモ科の植物。中国北部原産で、すりおろしてとろろとして食べるほか、煮物にも使われる。	new JA definition from EN	audit/missing-defs	2026-05-30
wnja-80001515-n		平均より小さい大きさ。小型であること。	new JA definition from EN	audit/missing-defs	2026-05-30
wnja-80001530-n		旧暦7月に行われる仏教行事。先祖の霊を迎えて供養する期間。	new JA definition from EN	audit/missing-defs	2026-05-30
wnja-80001531-n		台湾発祥の飲み物。紅茶や緑茶にミルクや果汁を混ぜ、タピオカのボールを入れたもの。	new JA definition from EN	audit/missing-defs	2026-05-30
wnja-80001553-n		ある言語の意味を別の言語で表現すること。書き言葉の言語間転換を指すことが多い。	new JA definition from EN	audit/missing-defs	2026-05-30
wnja-80001554-n		異なる言語を使う複数の当事者の間で口頭コミュニケーションを仲介すること。	new JA definition from EN	audit/missing-defs	2026-05-30
wnja-80001555-n		弦をはじいて演奏する弦楽器。琴・ハープ・ギターなどが含まれる。	new JA definition from EN	audit/missing-defs	2026-05-30
wnja-80001574-n		普段より遅い時間まで寝ていること。	new JA definition from EN	audit/missing-defs	2026-05-30
wnja-80001579-n		北西太平洋に広く分布する食用魚（タイ科、学名Pagrus major）。慶事に欠かせない魚として知られる。	new JA definition from EN	audit/missing-defs	2026-05-30
wnja-80001580-n		豆乳を加熱したときに表面に張る薄い膜を引き上げて作った食品。	new JA definition from EN	audit/missing-defs	2026-05-30
wnja-80001582-n		安価な食事を提供する屋外型の飲食施設。シンガポールや東南アジアで一般的。	new JA definition from EN	audit/missing-defs	2026-05-30
wnja-80001588-n		乗客が別の路線や交通機関に乗り換えることができる駅。	new JA definition from EN	audit/missing-defs	2026-05-30
wnja-80001609-n		時制・相・格・定性などの意味を付加する機能語の一種で、語形変化をしないもの。	new JA definition from EN	audit/missing-defs	2026-05-30
wnja-80001612-n		地域間・通勤列車より長い路線を走る都市間高速列車サービス。	new JA definition from EN	audit/missing-defs	2026-05-30
wnja-80001613-n		停車駅を絞り込み、速達性を重視した鉄道列車サービス。	new JA definition from EN	audit/missing-defs	2026-05-30
wnja-80001614-n		通常のバスより停留所が少なく、速達性を重視したバスサービス。	new JA definition from EN	audit/missing-defs	2026-05-30
wnja-80001637-n		仏教やインドの諸宗教において、惜しみなく与えること（布施）を中心とした徳目・実践。	new JA definition from EN	audit/missing-defs	2026-05-30
wnja-80001648-n		テキスト・画像など各種データを含む電子ファイル。	new JA definition from EN	audit/missing-defs	2026-05-30
wnja-80001649-n		コンパクトディスクに似た形状の光学ディスク。映像・音声・データの記録媒体として使われる。	new JA definition from EN	audit/missing-defs	2026-05-30
wnja-80001705-n		音楽において、聴く者を引き込む心地よいリズム感覚やグルーヴ感。	new JA definition from EN	audit/missing-defs	2026-05-30
wnja-80001707-n		機械が示す知的な振る舞い。学習・推論・問題解決などの能力を人工的に実現する技術。	new JA definition from EN	audit/missing-defs	2026-05-30
wnja-80001721-n		疑問文において使われる副詞。「なぜ」「どのように」「どこで」などが含まれる。	new JA definition from EN	audit/missing-defs	2026-05-30
wnja-80001918-n		正月に、既婚者や経済的に安定した大人が子どもや未婚の親族に渡すお金。	new JA definition from EN	audit/missing-defs	2026-05-30
wnja-80001962-n		購入または取得した数量。	new JA definition from EN	audit/missing-defs	2026-05-30
wnja-80002013-n		ワンタンと麺を合わせた料理。野菜とともに汁あり・汁なしで提供される。	new JA definition from EN	audit/missing-defs	2026-05-30
wnja-80002014-n		シンガポール・マレーシアの麺料理。卵麺と米麺を海鮮・豚バラ・野菜とともに黒醤油で炒めたもの。	new JA definition from EN	audit/missing-defs	2026-05-30
wnja-80002015-n		カニを甘辛いチリソースで炒めた料理。	new JA definition from EN	audit/missing-defs	2026-05-30
wnja-80002016-n		魚の頭を野菜とともにカレーで煮込んだ料理。	new JA definition from EN	audit/missing-defs	2026-05-30
wnja-80002094-n		白米を三角形や球形などに握り、具を包むこともある日本の携帯食。	new JA definition from EN	audit/missing-defs	2026-05-30
wnja-80002109-n		慶事や盂蘭盆節などに金銭を入れて贈る赤い封筒。中国文化圏・東南アジアで広く用いられる。	new JA definition from EN	audit/missing-defs	2026-05-30
wnja-80002158-n		遠慮から誰も手を付けずに最後まで残ってしまった食べ物の一切れ。	new JA definition from EN	audit/missing-defs	2026-05-30
wnja-80002182-n		社会において出生数が世代交代に必要な水準を下回る現象。	new JA definition from EN	audit/missing-defs	2026-05-30
wnja-80000273-r		長い年月をかけて。長年にわたって。	new JA definition from EN	audit/missing-defs	2026-05-30
wnja-80000671-x		旅が順調であるよう願って贈る言葉。	new JA definition from EN	audit/missing-defs	2026-05-30
wnja-80000704-r		ある空間や期間の全体にわたって。「世界中」「一年中」などの接尾辞的用法もある。	new JA definition from EN	audit/missing-defs	2026-05-30
wnja-80000793-v		出ることと入ること。行き来すること。	new JA definition from EN	audit/missing-defs	2026-05-30
wnja-80000807-r		たとえ〜であっても、という仮定・譲歩を表す接続詞的表現。	new JA definition from EN	audit/missing-defs	2026-05-30
wnja-80000886-v		ウェブサイトなどのデジタルコンテンツを見ること。閲覧すること。	new JA definition from EN	audit/missing-defs	2026-05-30
wnja-80000951-v		あちこちを歩き回ること。行ったり来たりしながら歩くこと。	new JA definition from EN	audit/missing-defs	2026-05-30
wnja-80001122-v		目を大きく開くこと。	new JA definition from EN	audit/missing-defs	2026-05-30
wnja-80001141-v		目を開くこと。または何かに目覚めること・悟りを開くこと。	new JA definition from EN	audit/missing-defs	2026-05-30
wnja-80001192-a		一人称の所有を示す連体詞。「私の〜」という意味を表す。	new JA definition from EN	audit/missing-defs	2026-05-30
wnja-80001235-v		新たに事業・医院・店舗などを開き、営業を始めること。	new JA definition from EN	audit/missing-defs	2026-05-30
wnja-80001277-r		全力を尽くして。命がけで取り組むさま。	new JA definition from EN	audit/missing-defs	2026-05-30
wnja-80001392-v		上に乗りかかること。重心を上に置くこと。	new JA definition from EN	audit/missing-defs	2026-05-30
wnja-80001435-v		整った状態が崩れること。乱雑になること。	new JA definition from EN	audit/missing-defs	2026-05-30
wnja-80001584-a		屋根や上部が開放されている車両を表す語。	new JA definition from EN	audit/missing-defs	2026-05-30
wnja-80001594-v		相手に（主にボールを）打ち返したり投げ返したりすること。	new JA definition from EN	audit/missing-defs	2026-05-30
wnja-80001595-v		以前持っていた人のもとへ物を返すこと。	new JA definition from EN	audit/missing-defs	2026-05-30
wnja-80002136-v		強引な手段や危険を冒して一度に多額の金銭を稼ぐこと。	new JA definition from EN	audit/missing-defs	2026-05-30
wnja-80002225-v		遠方の任地に赴いて職務に就くこと。	new JA definition from EN	audit/missing-defs	2026-05-30
